{
  "schemaVersion": "1.0.0",
  "recordType": "review-decision-batch",
  "batch": {
    "batchId": "promotion-wave-002-2026-08-29",
    "reviewerId": "claude-lead(operator-delegation-2026-08-28)",
    "reviewedAt": "2026-08-29T03:10:09Z",
    "notes": [
      "Second promotion wave: the three re-reviewed compounds with zero reviewer promotion blockers and no manifest hard blockers (dulaglutide, MOTS-c, sermorelin).",
      "Liraglutide also passed re-review with zero reviewer blockers but remains manifest-hard-blocked on missing A1/A2 authority linkage; it joins a later wave after the authority-support pass.",
      "Issued under OPERATOR-DELEGATION-2026-08-28. Go-live authority unchanged: promotion becomes effective only via seed PR merge."
    ]
  },
  "decisions": [
    {
      "decisionId": "promotion-wave-002-dulaglutide",
      "compoundName": "Dulaglutide",
      "decision": "approve-for-promotion",
      "reviewerId": "claude-lead(operator-delegation-2026-08-28)",
      "reviewedAt": "2026-08-29T03:10:09Z",
      "scope": {
        "claimIds": [],
        "qualityFlags": [
          "promotion-wave",
          "independent-re-review-passed"
        ],
        "reviewCategories": [
          "promotion-readiness",
          "soft-blocker-clearance"
        ],
        "promotionBlockers": []
      },
      "clearsSoftPromotionBlockers": true,
      "expiresAt": null,
      "notes": [
        "Basis: re-review-002-dulaglutide (approve-claims) from batch re-review-2026-08-29-batch-002. FDA-approved product (Trulicity) with label-backed regulatory claims; independent re-review (wf_0064b2e3-1b6) confirmed all 7 claims with zero promotion blockers.",
        "Soft blockers cleared: needsReview (expansion default; two independent review passes complete), completeness=partial (identifier metadata gap, tracked non-blocking), review-queue items (resolved by re-review).",
        "No hard blocker present in the current promotion manifest for this compound. Go-live gate remains the seed PR merge (Clint)."
      ]
    },
    {
      "decisionId": "promotion-wave-002-mots-c",
      "compoundName": "MOTS-c",
      "decision": "approve-for-promotion",
      "reviewerId": "claude-lead(operator-delegation-2026-08-28)",
      "reviewedAt": "2026-08-29T03:10:09Z",
      "scope": {
        "claimIds": [],
        "qualityFlags": [
          "promotion-wave",
          "independent-re-review-passed"
        ],
        "reviewCategories": [
          "promotion-readiness",
          "soft-blocker-clearance"
        ],
        "promotionBlockers": []
      },
      "clearsSoftPromotionBlockers": true,
      "expiresAt": null,
      "notes": [
        "Basis: re-review-002-mots-c (approve-claims) from batch re-review-2026-08-29-batch-002. Independent re-review confirmed all 6 claims incl. corrected PCAC committee-vote framing (7-5 FOR, against staff position); zero promotion blockers recorded.",
        "Soft blockers cleared: needsReview (expansion default; two independent review passes complete), completeness=partial (identifier metadata gap, tracked non-blocking), review-queue items (resolved by re-review).",
        "No hard blocker present in the current promotion manifest for this compound. Go-live gate remains the seed PR merge (Clint)."
      ]
    },
    {
      "decisionId": "promotion-wave-002-sermorelin",
      "compoundName": "Sermorelin",
      "decision": "approve-for-promotion",
      "reviewerId": "claude-lead(operator-delegation-2026-08-28)",
      "reviewedAt": "2026-08-29T03:10:09Z",
      "scope": {
        "claimIds": [],
        "qualityFlags": [
          "promotion-wave",
          "independent-re-review-passed"
        ],
        "reviewCategories": [
          "promotion-readiness",
          "soft-blocker-clearance"
        ],
        "promotionBlockers": []
      },
      "clearsSoftPromotionBlockers": true,
      "expiresAt": null,
      "notes": [
        "Basis: re-review-002-sermorelin (approve-claims) from batch re-review-2026-08-29-batch-002. Independent re-review confirmed all 6 claims; remediation agent's primary-source override (1997 trial: no DEXA body-composition change) upheld on second independent review; zero promotion blockers.",
        "Soft blockers cleared: needsReview (expansion default; two independent review passes complete), completeness=partial (identifier metadata gap, tracked non-blocking), review-queue items (resolved by re-review).",
        "No hard blocker present in the current promotion manifest for this compound. Go-live gate remains the seed PR merge (Clint)."
      ]
    }
  ]
}