{
  "schemaVersion": "1.0.0",
  "recordType": "review-decision-batch",
  "batch": {
    "batchId": "batch-1778616562911",
    "reviewerId": "cmorgan",
    "reviewedAt": "2026-05-12T20:09:22.911Z",
    "notes": []
  },
  "decisions": [
    {
      "decisionId": "dec-1778622357903",
      "compoundName": "Caffeine",
      "decision": "request-changes",
      "reviewerId": "cmorgan",
      "reviewedAt": "2026-05-12T21:45:57.903Z",
      "scope": {
        "claimIds": [],
        "reviewQueueItemIds": [],
        "qualityFlags": [
          "compiled-from-evidence-packet",
          "no-safety-canonicalization",
          "pilot-input"
        ],
        "reviewCategories": [],
        "promotionBlockers": [
          "review-required: 1 review queue item(s)",
          "review-required: completeness is partial",
          "review-required: draft is marked needsReview",
          "review-required: requested changes pending re-review"
        ]
      },
      "clearsSoftPromotionBlockers": false,
      "expiresAt": null,
      "notes": [
        "Recommended changes: expand the evidence packet beyond the pilot inputs; add authoritative safety sources before populating safety fields; address the prior requested-change decision dec-1778599390173; verify claim wording remains source-scoped and avoids dosing/timing advice; then send the updated draft back for human re-review."
      ]
    }
  ]
}
