{
  "schemaVersion": "1.0.0",
  "recordType": "review-decision-batch",
  "batch": {
    "batchId": "batch-1778626561933",
    "reviewerId": "cmorgan",
    "reviewedAt": "2026-05-12T22:56:01.933Z",
    "notes": []
  },
  "decisions": [
    {
      "decisionId": "dec-1778628971793",
      "compoundName": "BPC-157",
      "decision": "request-changes",
      "reviewerId": "cmorgan",
      "reviewedAt": "2026-05-12T23:36:11.793Z",
      "scope": {
        "claimIds": [],
        "reviewQueueItemIds": [],
        "qualityFlags": [
          "compiled-from-evidence-packet",
          "limited-human-evidence",
          "misinformation-heavy",
          "pilot-input",
          "regulatory-boundary"
        ],
        "reviewCategories": [],
        "promotionBlockers": [
          "review-required: 1 review queue item(s)",
          "review-required: completeness is partial",
          "review-required: draft is marked needsReview",
          "review-required: requested changes pending re-review"
        ]
      },
      "clearsSoftPromotionBlockers": false,
      "expiresAt": null,
      "notes": [
        "Recommended changes: add or attach a direct misinformation-monitoring source if making claims about online/common consumer narratives; keep FDA compounding-risk language narrow and source-scoped; separate compounded, research/vendor, investigational, and any approved-product contexts; avoid efficacy or “healing peptide” language; summarize preclinical interest separately from proven human outcomes; add route/formulation-specific safety context where available; then send the updated draft back through human re-review."
      ]
    }
  ]
}
